authoritarian a. n.  권위주의의, 독재주의의, 권위주의자
authoritative a. 권위있는, 믿을만한, 관현의, 당국의, 명령적인
authoritatively ad.엄연하게, 명령적으로
authority n. 권위, 권력, 권능, 권위자, 당국, 관례, 대가, 권한
authorization n. 위임, 인가
authorize vt. 권한을주다, 권능을주다, 위임하다, 인가하다, 정당하다고인정하다
authorized a. 권한을 부여받은, 공인된, 검정필의
Authorized Version x. 성서(1611년 영국왕 Jamesl의 명령으로 발행된 영역 성경)
authorless a. 저자 불명의
authorling n. 서투른 글장이
authorpublisher n. 자저 발행자
authorship n. 저작자임, 저술업, (저작물의)원작자, 저자, (소문 등의)출처, 근원
autism n. 자폐증
autistic a. 자폐성(자폐증)의
auto n. 자동차
autoaggressive a. =AUTOIMMUNE
autoalarm n. (선박등의)자동 경보기(장치)
autoanalysis n. (심리학적)자기 분석, 자동 분석
autoanalyzer n. 자동분석기
autoantibody n. 자기 항체
autobahn n. (독일의)고속차 전용 도로
autobahnen n.autobahn의 복수
autoball n. 오토볼(자동차에 의한 축구 시합, 브라질에서 시작됨)
autobiographer n. 자서작가
autobiographic a. 자서전의
autobiographical a. 자서전(체)의
autobiography n. 자서전
autoboat n. 발동기선
autobus n. 버스
autocade n. 자동차행렬
autocamp n. 자동차
autocar n.자동차
autocatalysis n. 자촉매 작용
autocatharsis n. 자기 정화(법)(자기의 경험을 글로 적음으로써 마음의 불안을 고침)
autocephalous a. 독립한, (교회 따위가)독립한
autochanger n. (레코드를 자동적으로 바꾸는)자동연속연주장치(달린 플레이어)
autochrome n. 컬러용건판
autochthon n. 토착민의, 토착동물
autochthonal a.토지 고유의;토착의;자생적인
autochthonic 토지 고유의;토착의;자생적인
autochthonism n. 토착, 토지 원산
autochthonous a. 토생의, 토착의
autocidal a. (해충을)자멸 유도하는
autocide n. (충돌을 일으켜서 하는)자동차 자살
autoclave n. 압력가마
auto court x. =motel
autocracy n. 독재정치, 전제정치
autocrat n. 독재자, 독재군주
autocratic a. 독재자의
autocratical a.독재자의;독재적인;독재정치의
autocratically ad.독재자로서;독재적으로
autocue n. 텔레프롬프터
autocycle n. 오토바이
autodafe n. 종교재판소의판결, 그처형(보통 화형)
autodidact n. 독학(독습자)
autodrome n. 자동차 경주 트랙
autodyne n. a. 오토다인 수신 방식(의)
autoerotic a. 자기 발정(색정)적인
autoeroticism n. =AUTOEROTISM
autoerotism n. 자기색정, 자기발정
autogamous a. 자기 생식의, 자화 수정의
autogamy n. 자가 생식, 자화 수정
autogenesis n. 자연(우연)발생(설)(abiogenesis)
autogenetic a.자생의;내생의;내인적인
autogenous a. 자생의, 내생의, 내인적인
autogeny n. 자생, 자기 발생(self-generation)
autogiro n. 오토자이로
autograft n. 자가이식편
autograph n. a. 자필서명한, 자필원고, 자필의, 자필로 쓰다, 자서하다
autographic a. 자필서명의
autographical a.자필의;자서의
autographically ad.자필로
autography n. 자서, 자필, (집합적)자필 문서, 육필 인쇄술(석판, 등사판 등)
autogravure n. 오토그라비어(사진판 조각법의 일종)
autogyro n. =AUTOGIRO
autohypnosis n. 자기최면
autoignition n. (내연 기관의)자기 점화, 자기 착화, 자연 발화
autoimmune a. 자기(자가)면역의
autoinfection n. 자기 감염
autoinjector n. (신경가스 등에 대해 사용하는)자기(피하)주사기
autoinoculation n. 자기접종
autointoxication n. 자가중독
autoist n. =MOTORIST
autokinesis n. 자발 행동, 자동 운동
autokinetic a. 자동 적인
autoland n. 자동착륙
autoloading a. (총기가)자동 장전식의
autologous a. 자가 이식한, 자가 조직의
autolysin n. (동식물 조직을 파괴하는)자기 분해제
autolysis n. 자기 분해(소화)
autolyze vt. vi. 자기 분해 시키다(하다)
automaker n. 자동차 제조업자(회사)
automan n. 자동차 제조업자
automanipulation n. 자위
automat n. 자동판매기, 자동판매식음식점
automata n. automation의 복수
automate vt. 오토메이션화하다, 자동화하다, 자동장치를 갖추다
automatic a. n.  자동식의, 기계적인, 무의식적인, 습관적인, 자동 기계(장치, 권총)
automatical a. 자동적인
automatically ad.자동식으로
automatic calling x. 자동호출
automatic data processing x. 자동 정보 처리
automatic drive x. 자동 변속 장치
automatic interplanetary x. 자동 혹성간 스테이션(우주 로켓에 대한 소련 호칭)
automaticity n. 자동성
automatic operation x. 자동조작
automatic pilot x. 자동조종장치
automatic telephone x. 자동전화
automatic train control x. 열차자동제어장치
automatic train stop x. 열차자동정지장치
automation n. 오토메이션, 자동조작
automatism n. 자동, 자동현상, 작용
automatization n. 자동화, 오토메이션
automatize vt. 자동화하다, 오토메이션화하다
automatograph n. 자동 운동 기록기
automaton n. 자동인형, 기계적으로행동하는사람
automobile n. 자동차
automobilism n. 자동차 사용(운전, 여행)
automobilist n. 자동차 운전자, 자동차 소유자(상용자)
automotive a. 자동차의, 자동적인
autonetics n. 자동 유도 제어학, 자동 제어론
autonomic a. 자치적인, 자율적인
autonomist n. 자치론자, 자치주의자
autonomous a. 자치적인, 독립된
autonomy n. 자치, 자치권, 자치제
autonym n. 본명, 실제이름, 본명으로낸저서
autopen n. 자동 서명기
autophagy n. 자기 소모, 자식 작용
autophone n. 자동전화
autopilot n. 자동조정장치
autopista n. (스페인어권의)고속 도로
autoplasty n. 자기조직이식술(피부의 이식 따위)
autopolo n. 자동차 폴로 경기(자동차를 타고 있는)
autopsy n. 검시
autopsychosis n. 자의식 장애성 정신병
autoptic a. 실지 검증의, 검시의, 시체 해부의
autoptical a.검시의;시체 해부의
autoradiograph n. 방사선사진
autoregulation n. (장기, 생물, 생태계 등의)자기 조절
autoreverse n. 오토리버스(테이프 녹음(재생)중, 한 면이 끝나면 자동 역전하여 녹음(재생)을 계속하는 기능)
autoroute n. (프랑스, 벨기에의)고속도로
autosdage n. AUTODATE의 복수
autosexing a. 태어날(부화할)때 자웅 별로 각기 특징을 나타내는
autoshape vi. (자극에 대하여)자기 반응을 형성하다
autosled n. 자동 썰매
autosome n. 상염색체(성염색체 이외의 염색체)
autostability n. 자율 안정, 자동 조종(제어)안정
autostrada n. (이탈리아의)고속 도로(experssway)
autostrade n.autostrada의 복수
autosuggestion n. 자기암시
autotelic a. 자기 목적적인, 그 자체에 목적이 있는
autotimer n. (전기 조리기 등의)자동 타이머
autotomize vi. vt. (도마뱀 등이)자절하다
autotomy n. (도마뱀 등의)자기 절단, 자절
autotoxic n. 자가 중독(증)
autotoxin n. 자가 독소
autotrain n. 오토트레인(일정 구간을 승객과 자동차를 동시에 수송하는 열차)
autotransformer n. 단권 변압기
autotransplant n. vt. =AUTOGRAFT
autotronic a. (엘리베이터가)자동전자장치의
autotroph n. 독립(자가 무기)영양 생물
autotrophic a. 자가(독립, 자급)영양의
autotruck n. 화물자동차, 트럭
autotype n. vt. 오토타이프(단색 사진판), 복사, 모사, 오토타이프 복사를 하다
autotypography n. 단색 사진판법
autoworker n. 자동차 제조 노동자
autoxidation n. 자동 산화
autumn n. 가을
autumnal a. 가을의
autunite n. 인회
auxiliary a. 보조의, 추가의, 보조사, 외인 부대, 조동사
auxiliary verb x. 조동사
auxin n. 옥신(식물 성장 물질의 총칭)
auxo n. 생장, 증대, 촉진, 자극
auxotroph n. 영양 요구체(영양 합성이 불가한 균주)
auxotrophic a. 영양 요구성의
avail vt. vi. n.  도움이되다, 소용이되다, 이롭다, 이익, 효용, 
availability n. 유효, 유익, 도움, 쓸모
available a. 이용할 수 있는, 손에넣을수있는, 전심할수있는, 여가가있는, 유효한
availably ad.유효하게;이용할 수 있게
avalanche n. vi. 눈사태, 쇄도, 쇄도하다, 눈이나산 사태나다
avalanchine a. 사태 같은
avalement n. 아발망(활강, 회전에서 허리를 낮추어 속도를 올리는 방법)
avantcourier n. 선구자, 전위, 선봉(advance guard)
avantgarde n. (예술상의)전위, 아방가르드
avarice n. 탐욕
avaricious a. 탐욕스러운
avariciously ad.탐욕스럽게;욕심 사납게
avast int, 그만, 멈춰
avatar n. 화신, 권화
avaunt int, 가라, 물러가라
ave int, 어서 오세요!, 안녕!, 자 그럼!-=AVEMARIA
avenge vt. vi. 원수를갑다, 복수하다, 대응하다
avenger n. 복수자, 원수를 갑는 사람
avenging a. 복수의, 복수의
avens n. 뱀무속의 식물
aventurin n.구릿가루 따위를 뿌려 꾸민 유리;사금석
aventurine n. a. (구리 가루를 넣은)갈색의 유리, 사금석, 반짝반짝 빛나는
avenue n. 가로수 길, 가로, 큰거리, (성공 따위에의)
aver vt. 단언하다, 주장하다
average n. a. vt. 평균의, 표준의, 보통의, 해손-평균하다, 평균 ..이 되다, (증권 따위를 매매하여)평균값을 내리다
average out 이익이 있거나 손실없는 결과로 끝나다;평균이 되다
average up (상품,증권 등의 거래에서)평균가격을 올리다
averagely ad.보통으로;평균으로
averager n. 해손 천산인
averment n. 주장, 단언
Avernus n. 에버너스, 이탈리아의 나폴리 부근의 호수(지옥의 입구로 불려졌음)
averse a. 싫어하다, 반대하여
averseness n.싫어함
aversion n. 혐오, 반감
aversive a. 혐오의, (불쾌, 고통 등을)피하려고 하는, 회피적인
avert vt. 돌리다, 피하다, 막다
avertable a.피할 수 있는
avertible a. 피할 수 있는, 말을 수 있는
Avery n. 남자 이름
Aves n. 조류
Avesta n. 아베스타(조로아스터교의 경전)
Avestan n. a. 아베스타 말, 아베스타 말(경전)의
avgas n. =AVIATION GASOLINE
avian a. 새의, 조류의
aviarist n. 애조가, 새 기르는 사람
aviary n. 새장, 양금사
aviate vi. 비행하다, (특히)항공기를 조종하다
aviation n. 비행술
aviation badge x. 항공기장
aviation corps x. 항공대
aviation ground x. 비행장
aviation medicine x. 항공의학
aviation spirit x. 항공용경유
aviator n. 비행사
aviator's ear x. 고공비행성 중이염
aviatress n. =AVIATRIX
aviatrix n. 여류 비행가
aviculture n. 조류사육
avid a. 탐욕스러운, 갈망하는
avidity n. 갈망, 탐욕
avidly ad.게걸스럽게
avifauna n. (한 지방 또는 한 나라의)조류
aviform a. 새 모양의
avigation n. 항공(학), 항법
Avignon n. 아비뇽(남프랑스의 도시, 교황청 소재지(1309-77)
avion n. 비행기
avionics n. pl, 항공 전자 공학
avionics n. 항공전자공학
avirdupois n. 상형(16온스를 1파운드로 정한 형량)
avirulent a. (생물체가)독성이 없는, 악성이 아닌
aviso n. 통보함
avitaminosis n. 비타민 결핍증
avocado n. 애보카도
avocation n. 부업, 여기, 취미, 직업, 본직
avocatory a. 호출하는, 소환하는
avocet n. 됫부리장다리떼새
Avogadro n. 아보가드로 Count Amedeo ~ (1776-1856)(이탈리아의 화학자, 물리학자)
avoid vt. 피하다, 회피하다
avoidable a. 피할 수 있는
avoidance n. 도피, 회피, 무효
avoir x. , avoirdupois
Avon n. 영국중부의 강, 잉글랜드 남서부의 주(1974년 신설)
Avon n. 에이번강(영국 중부의 강, Shakespeare의 출생지 Stratford는 이 강가에 있음), 에이번주(1974년 신설된 잉글랜드 중부의 주)
avoirdupois n.상형(귀금속,보석,약품외에 쓰는 형량);무게
avoset n. =AVOCET
avouch vt. 공언하다, 단언하다, 확언하다, 보증하다, 인정하다, 자백하다
avouchment n.승인;자백
avow vt. 공언하다, 시인하다
avowal n. 공언, 자백, 시인
avowed a. 스스로 인정한(언명한), 공공연한(open)
avowedly ad.공공연히, 명백히
avulse vt. 무리하게 떼어놓다, (조직을)벗겨 내다
avulsion n. 무리하게 떼어냄(벗겨냄), (홍수 등에 의한)토지의 전위(자연 분리), 떼어 낸 부분, 분열지
avuncular a. 아저씨, 백부 또는 숙부
aw int.저런;아니
await vt. 기다리다
awake vt. vi. a. 깨우다, 일으키다, 자각시키다, 눈뜨다, 깨다, 깨닫다, 분기하다(to), 깨어서, 방심 않는, 잘 알아채서
awaken vt. vi. =awake
awakening a. n.  눈뜨게한는, 깨우치는, 눈뜸, 각성
award vt. 수여하다, 심사하여주다, 재정하다
awardee n. 수상자, 판정(장학금 등)을 받은 사람
aware a. 깨닫고, 알아차리고
awareness n. 알아채고(깨닫고)있음, 자각, 인식
awash a. (암초, 침몰선 등이)수면과 거의 같은 높이로, 파도에 씻기어, 파도에 시달려, (장소가)..으로 가득하여
away ad.떨어져서, 부재하여, 점점 소멸하여, 없어져, 끊임없이
away from 멀리서부터
awe n. 외경(stand in~of ..을 외경(두려워)하다
Aweapon n. 원자병기
aweary a. =WEARY
aweather ad.바람 불어오는 쪽에
awed a. 경외심을 나타낸(가지고 있는)
aweigh ad.a. 닻이 해저에서 떨어져
aweinspiring a. 엄숙한, 두려운마음이일게하는, 옷깃을 바로 잡게 하는, 엄숙한
aweless a.위엄이 없는;무서움을 모르는
awesome a. 두려운, 무서운
awestricken a. 두려운감이들어, 두려워하여
awestruck a. 위엄에 눌린, 두려운 생각이 든, 위압당한
awful a. 두려운, 장엄한, 대단한, 무서운, 굉장한
awfully ad.무섭게
awfulness n. 두려운 일, 장엄, 지독함, 굉장함
AWG x. American Wire Gauge
awheel ad.a. 자동차(자전거)를 타고
awhile ad.잠시
awhirl ad.a. 소용돌이쳐서, 빙빙돌고
awkward a. 보기흉한, 섣부른, 서투른, 약 빠르지 못한, ..하기 어려운(to do), 어색한, 사용하기 거북한
awkwardly ad.
awkwardness n. 
awl n. (구둣방 따위의)송곳
awless a. =AWELESS
awn n. 꺼끄러기, 보리따위의 꺼끄러기
awned a. 까끄라기가 있는
awning n. 차일, 비막이, 천막
awoke v 깨우다의 과거분사
awoken vt.vi.awake의 과거분사
awry pred. a. ad, 뒤틀린, 뒤틀리어, 일러진, 잘못되어(go(run)~ 시패하다, look~ 스처(곁눈질로)보다
ax n. 도끼, 삭감, 면직(have an~ to grind 속 배포가 있다, 생각하는 바가 있다, put the~in the helve 수수께끼를 풀다
axal a. =AXIAL
axe n. =AX
axedarach n. 단향목(chinaberry tree)
axegrinding a. 딴마음이 있는
axel ['æks~∂l(스케이트에서)액슬, 점프하여 공중에서 ａ회전 반 함
axeman n. =AXMAN
axenic a. 무균의, 무기생물의
axes axe의 복수
axgrinder n. 음모가, 속배포가 있는 사람
axhammer n. (돌 등을 깨거나 다듬는 데 쓰는)도끼처럼 생긴 메
axial a. 굴대의, 축의
axially ad.축으로
axil n. 엽액
axile a. 굴대의, 축의, 굴대에 있는
axilla n. 겨드랑이
axillae n.axilla의 복수
axillar n. 겨드랑이 부분(혈관, 신경, 깃 등)
axillary a. 
axillary a. 엽액의, 겨드랑이의
axinite n. 부석
axiology n. 가치론, 가치철학
axiom n. 공리, 자명한이치
axiomatic n. 굴대, 축, 추축
axiomatical a.공리의;통칙의;자명한;격언조의
axiomatically ad.자명하게;공리로서
axis n. 굴대, 축, 추축
axisymmetric a. 선대칭의
axle n. 축, 굴대, 차축
axletree n. (마차 등의)굴대, 차축
axlplasm n. 축삭 원형질
axman n. 도끼질하는 사람, 나무꾼(woodman)
Axminster n. (영국산의)부드러운 털융단
axolotl n. 액솔로틀(멕시코산 도롱뇽의 유생)
axolotl n. 아홀로틀, 멕시코산 도룡뇽의 총칭
axon n. (신경 세포의)축삭
axone n.(신경세포의)축색돌기
axonometry n. 축측 투상법
axstone n. 도끼돌남미에서 돌도끼를 만드는 재료)
ay int.그렇소;찬성! n.찬성 ad.언제나;항상
ayah n. 하녀, 유모
ayatollah n. 아야톨라, 이란의 이슬람 최고 지도자의 호칭
aye int, n.  =yes-찬성, 찬성자
aye ad.언제나, 늘, 영구히, 영원히
aye int, 찬성, 찬성자
ayeaye n. 다람쥐원숭이
Aylesbury n. 에일즈베리(잉글랜드 Buckinghamshire 주의 주도)
Aylmer n. 남자 이름
Aymara n. 아이마라족(볼리비아와 페루의 인디오)
Ayr n. =AYRSHIRE, 에어(aYSHIRE의 주도로 항구 도시)
Ayrshire n. 에어셔주(스코틀랜드 남서부의 옛주), 그 주 원산의 젖소
az =azo-;azimuth;`탄소 대신에 질소를 함유하는'의 뜻
aza a. 탄소 대신에 질소를 함유하는
azalea n. 진달래
azan n. (회교국의 교당에서 하루에 5번 울리는)기도의종
Azania n. 아자니아(민족주의자의 용어로서 남아프리카 공화국의 호친)
azarole n. 아자롤(지중해 지방에 나는 산사나무류의 관목), 그 열매
azeotrope n. 공비 혼합물
Azerbaijan n. 독립국 연합의 공화국의 하나(카스피해 연안에 있음)
azide n. 아지드, 아지화물(폭발하기 쉬운 화합물)
Azilian a. 아질 문화(기)의(서유럽 중석기 시대의)
Azilian a. 아질기, 구석기시대와 신석기시대의 중간
azimuth n. 방위, 방위각
azimuthal a. 방위각의
azioc a. 무생의, 무생물시대의
azo a. (화합물이)질소를 함유하는, 아조의
azo n. 질소(nitrogen)
azobenzene n. 아조벤젠
azobenzol n.아조벤젠
azoic a. 무생의, 무생물 시대의
azonic a. 특정 지대에 한정되지 않는, 지역적이 아닌
Azores x. 북대서양의 군도(포르투갈령)
azote n. 질소(nitrogen)n. 
azoth n. (연금술에서 모든 금속의 원소로 생각되었던)수은, 만능약
azotic a. 질소의
azotize vt. ..을 질소와 화합시키다
Azov n. 아즈라엘(죽음에 순간에 영혼을 육체에서 분리시키는 천사)
Aztec n. 아즈텍인(1519년 스페인에 정복되 멕시코 토인)
Aztecan a. 멕시코 원주민, =AZTEC
azure n. 푸른하늘, 하늘빛
azurine a. 청색의(blue), 엷은 청색의(pale blue)
azurite n. 남동광
azygous a. 쌍(짝)을 이루지 않는
B.A. 문학사(=bachelor of Arts);대영학사원
azyme n. 무교병(유대교가 유월절에 씀)
B n. 두번째문자, 나음, 나조
B, & W,  x. black and white
B, a. a.  x. British Airports Authority
B, a. Sc x. Bachelor of Agricultural Science, Bachelor of Applied Science
B, Ag,  x. Bachelor of Agriculture
B, Arch x. Bachelor of Architecture
B, B x. BlueBook
B, E, C,  x. Bureau of Employees' Compensation
B, E, M,  n. British Empire Medal(1941년 제정)Bug-Eyed Monster(왕방울 눈의 괴물, 과학 소설에 나오는 공상적인, 생물)
B, I, E,  x. Bachelor of Industrial Engineering
B, I, F,  x. British Industries Fair
B, I, M,  n. British Institute of Management 영국 경영 연구소
B, I, O, T,  x. British Indian Ocean Territory
B, I, P, O,  x. British Institute of Public Opinion
B, I, S,  x. Bank for International Settlement 국제 결제 은행, British Information Services 영국 정보부
B.E.C.S. x. British Red Cross Society
B.O.a..C. n. British Overseas Airways Corporation 영국 해외 항공 회사
b.c. before Christ;Bachelor of Chemistry
baa n. 매애(양의울음소리)
baal n. (고대Phoenicia 사람의)발신, 주신, 태양신, 우상, 사신
baalamb n. 매매(새끼양을 이름)
Baalism n. 숭배(우상), 발신
Baalist n. 발신숭배자, 우상숭배자
baas n. 주인, 나으리
Baath n. 바트당, 아랍의 민족주의 정당
Bab n. 바바라(Barbara)의 애칭
baba n. 럼주로 맛낸 건포도 과자
babbitt n. 독선적인 속물 취미의 실업가
Babbitt n. 배비트 합금, 주석, 납의 합금
Babbittry n. 속물적인 실업가 기질, 속물취미
babble n. vi. ti, 떠듬거리는 말, 허튼소리, 수다, 지껄여 누설하다
babbler n. 서투르게 지껄이는 어린애, 수다쟁이, 높은 소리로 지저귀는 작은 새
babbling a. n.  재잘거리는, 졸졸 흐르는, 수다, 졸졸 흐르는 소리
babe n. =baby천진 난만한 사람, 숫보기
Babel n. 바벨 탑(옛날 Babylon 에서 하늘까지 닿도록 쌓으려던 탑, 천벌로 인부들이 서로 말이 통하지 않게 되어 완성에 실패
Babelize vt. (언어, 습관, 민족 등을)혼란에 빠뜨리다
babiesbreath n. 대나물, 광대나물
babiroussa n.바비루사(동인도 제도산의 멧돼지)
babirusa n. 멧돼지의 일종(동인도 산)
baboo n. 영어를 쓸 줄 아는 서기, 영국물이 든 인도인
baboon n. 비비, 보기싫은놈
baboonery n. 비비 같은 짓(태도)
babouche n. 슬리퍼, 실내화(터키 등에서 씀)
babu n.(인도에서)mr.,sir,esq.에 해당하는 칭호;인도 신사
babul n. 아카시아속의 고무나무, 그 재목(수지)
babushka n. 세모꼴의 여자들 머리쓰개
baby n. 갓난애, 작은동물(물건), 젊은 여자, 소녀, 애인(gold the~ 성가신 것을 떠맏다), pass the~ 책임 회피하다)
babybattering n. 유아징계(학대)
baby blue x. 옅은 푸른색
baby carriage x. 유모차
baby farm x. 육아원, 탁아소
baby grand x. 소형 그랜드 피아노
babyhood n. 유아기, 젖먹이
babyish a. 어린애 같은, 유치한, 어리석은
babylike a. 어린애 같은
Babylon n. 바빌론, 화려한 도회, 타락의 도시
Babylonia n. 아시아 남서부 고대제국
Babylonian a. n.  바빌로니아의, 죄많은, 바빌로니아 사람, 바빌로니아 말
babyminder n. =BABY SITTER
babysat vi.vt.(집을 지키며)아이를 보다;아이를 보살피다
babysit vi. 어린아이를 보아주다
babysiter n. 어린아이 봐주는 사람
babysiting vi.vt.(집을 지키며)아이를 보다;아이를 보살피다
babysitter n.베이비 시터(집을 지키며 아이를 돌봐주는 사람)
babysitting n. babysitter의 일, do ~ 집 지키며 애보기를 하다
baby talk x. 유아 말
baccalaureate n. 학사의 학위(대학 졸업생에 대한)송별 설교
baccanal a. n.  주신, 바카스의, 바카스 예찬의, 바카스 예찬자, 주정꾼
baccara n.배커라(카드를 쓰는 도박의 일종)
baccarat n. 바카라, (도박용 카드놀이의 일종)
baccatate a. 장과(berry)를 맺는, 장과 모양의
Bacchae n. 주신 바커스의 시녀(무녀)들, 바커스제 여성 참가자들
baccate a.장과 모양의(-를 맺는)
bacchanal n. BACCHUS의, 술 마시며 떠들어대는, 주신 바커스의 신도, 취하여 떠드는 사람, 떠들썩한 술잔치
Bacchanalia n. (고대 로마의)주신제, 통음난무
Bacchanalian a. pl, 바카스의
bacchanalian n.바커스(주신)제의;바커스 예찬자;취해 떠드는(사람)
bacchant n. 주신 바카스의 사제, 술마시고 떠드는 사람
bacchante n. 바커스 신의 여사제(여신도), 여주객
bacchantic a. 바커스를 숭배하는, 술마시며 떠들어대는, 술을 좋아하는
Bacchic a. 주신 바카스의, 만취한
Bacchus n. 바카스, 술의 신
bacchic a.바커스신의;바커스를 숭배하는
bacciferous a. 장과를 맺는
bacciform a. 장과 모양의
bacco n. 담배
baccy n. (tobacco의 단축형)담배
Bach n. 독일의 작곡가
bach n. vi. 독신자, 독신 생활을 하다
bachelor n. 독신자, 학사
bachelor of arts n.문학사
bachelor of science n.이학사
bacheloratarms n. 다른 기사를 섬기는 젊은 기사
bachelordom n. 독신, 독신 기질, 독신자
bachelorette n. (자립 생활 하는)독신 여성
bachelor girl x. 젊은 독신 여성
bachelor girl (자활하고 있는)젊은 독신여성, 
bachelorhood n. 독신 생활, 독신 시절
bachelorsbutton n. 수레국화, 수레국화 따위
bachelorship n. 독신, 학사의 자격
bacil pref.간상균의 뜻
bacilius n. 간상균, 세균
bacillar a.간상의;바실루스의;간균에 의한
bacillary a. 간상의, 간균의
bacilliform a. 작은 막대기 모양의
bacillus n.바실루스;간상균;세균;박테리아
bacitracin n. 바시트라신(항생물질)
back n. a. ad, 등, 잔등, 뒤, 후부, 안, (손발의)등, (의자의)등널, 등뼈, 산등성이, 후위, 뒤의, 배후의, 안의, 속의, 벽지의, 거꿀의, 밀린, 이전, 뒤로, 뒤쪽으로, 뒤에
back n. vt. 등, 뒤, 후퇴하다
back away 서서히 후퇴하다;뒷걸음치다
back down vi.뒤로 물러서다(from);취소하다;양보하다
back out (-에서)손을 매다(of from)(약속을)취소하다
back room n.안쪽 방;비밀의 정치적 회합;비밀 연구소
back seat n.뒷자리;눈에 뜨지 않는 위치;말석
back street n.뒷거리;뒷골목
back up vt.후원하다;대리하다;정체하다
backache n. 등의 통증
backalley a. 은밀한, 음성적인, 뒤가구린
backband n. 등띠(말의 끌채를 붙들어 매는)
backbench(er) n. 하원 뒷자리, (하원 뒷자리에 앉은 평의원)
backbite vt. vi. 험담하다
backbiter x. 험담하는 사람
backblock n. 오지, 벽지의 목장
backboard n. 뒤판, 백보드(농구의), 척추교정판
backbone n. 등뼈, 기골
backboned a. 등뼈가 있는, 기골이 있는(firm, resolute)
backbreaker n. 몹시 힘드는 일, 맹렬히 일하는 사람
backbreaking a. 몹시 힘드는
backcast vt. vi. (연구, 자료에 의거)(과거의 일을)재구성하다, 기술하다, 묘사하다, 뒤로 선지기, (낚시)백캐스트(낚싯줄을 던지는 예비 동작)
backchat n. 말대꾸, 대답, 수작, 모욕
backcloth n. =BACKDROP 1
backcomb vt. (머리를)거꾸로 빗어 세우다(tase)
back country x. 벽촌
backcountry n. 시골, 벽지, 미개척지
back country x. 벽촌
backcourt a. (테니스의), 백코드
backcross vt. vi. n.  역교배를 시키다, 역교배
