bizarre a. 괴기한, 기묘한
bizarrerie n. 괴기(한 것), 그로테스크
Bizet n. 비제(1838-75)(프랑스의 작곡가)
bizonal a. 2국 공동 통치 지구의, (제 2차 대전 후의 서독의)미영 양국 점령지구의
bizone n. 서독의 미영점령지구
Bizonia n. 서독의 미영 점령 지구
bizzbazz n. 부질없는 수다
Bjornson n. Bjornstjerne(1832-1910)뵤른슨(노르웨이의 시인, 소설가, 극작가)
blab vt. vi. n.  지절거리다, 비밀을 누설하다, 지절거리는(비밀을 누설하는) 사람, 지절거림
blabber n. 수다쟁이
blabbermouth n. 수다쟁이, 비밀을 지껄여 대는 사람
black a. n.  vt. vi. 검은, 더러운, 암담한, 지르퉁한, 불길한, 사악한, 험악한-검정, 흑색, 흑점, 검은 그림물감, 흑인-검게 하다, (구두를)닦다, 더럽히다
black art n.마술;(미국의)흑인 예술
black beetle n.바퀴
black book n.블랙리스트;여자 친구의 주소록;연감식의 광고 편람
black lead vt.흑연을 바르다(으로닦다)
black letter a.흑체(블랙)활자(체)의;불길한;불행한
black market n.암시장
black sea n.흑해
black sheep n.(흰 양떼속에 드물게 생기는)검은 양;말썽꾸러기
black tea n.홍차
blackamoor n. 흑인, 아프리카 흑인, 피부색이 검은 사람
blackandblue a. (얻어 맞아서)시퍼렇게 멍이 든
blackandtan a. n.  (개가)검은 바탕에 갈색이 섞인, 백인과 흑인의 비례 대표제를 주창하는, 백인과 흑인 양편이 빈번히 출입하는, 테리어 개의 일종, 백인, 흑인이 모두 잘 출입하는 나이트클럽
blackandwhite a. n.  흑백의, 펜화의, 단색의, 흑백 텔레비전(사진), 흑백 얼룩의, 측백이 뚜렷한 (논리 등), 초콜릿 크림
black art x. 마술, 마법
blackavised a. 색이 검은, 얼굴 색이 검은(거무스름한)
blackball vt. n.  (검은 공을 던져서)반대 투표하다(vote against), (사회에서)배척하다, 반대 투표, (반대 투표용의)검은 공
blackballer n. 반대 투표자
blackbeetle n. 바퀴, 진딧물
black belt x. 흑인지대
blackberd n. 찌르레기, 지빠귀, 노에선에 붙잡힌 캐너켜 원주민
blackberry n. vi. 검은딸기(의 열매), 검은 딸기를 따다
blackbird n. 검은새(지빠귀 무리), 찌르레기과의 새, 흑인, 노예선에 유괴된 카나카(Kanaka)사람
blackbirding n. 흑인 노예 유괴(매매)
blackboard n. 칠판
blackbody n. 흑체(모든 파장의 복사를 흡수하는 가상 물체)
black book x. 블랙리스트, 요시찰인명부
black box x. 전자장치
Blackcap n. (머리가 검은 유럽산의)꾀꼬리의 무리, (미국산의)박새의 무리, (열매가 검은)나무딸기류
blackcap n.(머리가 검은)명금;박새류
blackcapped a. (새가)머리가 검은, 검은머리의
black chamber x. 첩보기관
blackcoat n. (검은 옷을 입는)성직자, 월급장이
black comedy x. 블랙코메디(빈정ㄷ는 유머가 깃든 희극)
Blackdamp n. (탄갱 안의)질식 가스
black death x. 흑사병, 페스트
black diamond x. 석탄
black dog x. 우울, 기분이 언짢음
black draught x. 화제의 일종
blackcock n.멧닭의 수컷
blackcurrant =black stream
blackdamp n.(탄갱 안의)질식 가스
blacken vi. vt. 검게(어둡게)하다, 비방하다
Black Engish x. 흑인 영어
blacker n. 검게 하는 사람, 비방하는 사람
blacketeer n. 암거래 상인
black eye x. (맞아서 생긴)눈언저리의 멍
blackeyed a. 눈이 까만, 눈언저리가 퍼런, 멍이 든
blackface n. 흑인으로 분장한 배우(가수), 굵은(블랙)활자
blackfaced a. 얼굴이 검은, 침울한 표정을 한, 굵은(흑체)글자의
blackfellow n. 오스트레일리아 원주민
blackfish n. 둥근 머리의 돌고래, 검은 물고기(농어 따위)
blackflag n. (해골을 그린)해적기
Blackfoot n. 블랙푸트족(북미 토인의 한 종족), 그 언어
Black Forest x. 독일 서남부의 삼림 지대
Black Friday x. 불길한 금요일(예수가 처형된)
black gold x. 석유
blackguard vt. vi. 불량배, 깡패, 악한, 악담하다, 욕지거리하다, 불량배처럼 행동하다
blackguardly a. 불량배의(와 같이), 말 버릇 더러운(더럽게)
Black Hand x. 흑수단(범죄를 일삼던 이탈리아계 미국인의 비밀 단체), 폭력단
blackhead n. 검은 여드름, 머리가 검은 각종 새
blackheart n. (야채, 감자 등)속썩음병, 검은 버찌
blackhearted a. 뱃속 검은
black humo(u)r x. 블랙 유머(빈정거리는 병적인 유머)
blacking n. 흑색 도료, 구두약
black ink x. 검정 잉크, 흑자, 대변
blackish a. 거무스름한
blackjack n. vt. 큰잔, 조끼, 해적기, 곤봉(으로 때리다), 협박하다
blackjack n. vt. 큰 잔, 해적기, 협박하다
black lead x. 흑연
blackland n.흑토;흑토 지대
blacklead vt. 흑연을 칠하다(으로 닦다)
blackleg n. 사기꾼, 파업파괴자
black letter x. 고딕활자
blackletter a. 흑체 문자의, 블랙(고딕)활자의, 불길한, 불행한
black lie x. 악의 있는 거짓말
blacklist n. 요주의 인물 명
black lung x. 탄진폐
blackly ad.검게, 어둡게, 암흑으로, 음울하게(gloomily), 화가 나서, 간악하게(wickedly)
blackmail n. vt. 갈취(한돈), 공갈(하다)
Black Maria x. 죄수 호송차
black maria x. 죄수호송차
black mark x. 흑점
black market x. 암시장
black marketeer x. 암거래상인
Black Monday x. 방학 후의 첫 등교일
black monday x. 방학후의첫등교
Black Muslim x. 흑백인의 완전 격리를 주장하는 흑인 회교 단체
black muslim x. 흑인회교단체
black nationalism x. 흑인민족주의
blackmailer n.등쳐먹는 자;공갈자;공납
blackness n. 검정, 흑색, 흑점
blackout n. (무대의)암전, 등화 관제, (방향 급변 따위로 인한)일시적 시력(의식)상실
blackout n. 암전, 등화 관제, 일시적 시력 상실
Black Panther x. 검은 표범(미국의 흑인 과격파 당원)
black panther x. 검은표범
black pepper x. 후춧가루(껍질째 빻은)
blackplate n. 흑판(부식 방지의 도금이나 마무리 칠을 하지 않은 철판)
black point x. 흑수병
blackpoll n. 검은머리솔새(미국산)
Black Power x. 흑인(지위 향상)
black power x. 흑인운동
black pudding x. 검은 소시지(돼지의 피나 기름을 넣어 만듦)
black pudding x. 검은소시지
black sea x. 흑해
Blackshirt n. 검은 셔츠 당원(이탈리아의 Fascist의 별명)
blackshirt n.이탈리아 국수주의당원
blacksmith n. 대장장이
blacksnake n. 먹구렁이, 쇠가죽 채찍
blacksploitation n. =BLAXPLOITATION
black spot x. 위험 구역
Black Stream x. 흑조
black tea x. 홍차
black tea x. 홍차
blackthorn n. 자두나무, 산사나무
blacktie n. 검은 넥타이, 신사, 명사
blacktop n. (포장에 쓰이는)아스팔트, 아스팔트 도로
blackwash vt. 폭로하다
black watch x. 스코틀랜드고지 제42연대
blackwater fever n. 흑수열(악성 말라리아)
blacky n. 검둥이, 검은 동물(새 등)
bladder n. 방광, (물고기)부레
bladderwort n. 토알속의 식물
bladdery a. 방광 모양의, 기포가 있는, 부푼
blade n. 잎, 칼날, 칼, 검객, 멋장이, 날개, 견갑골
bladebone a. (..의)잎사귀가 있는, (..의)칼날이 있는
bladebone n. 견갑골
bladelette n. 세석인(박편 석기의 하나)
bladesmith n. 칼 대장장이
blaeberry n.=bilberry
blaebery n. =BILBERRY
blague n. 속임수, 엉터리, 허풍
blah xint, n.  바보같이-허튼소리, 어리석은 것
blain n. 수포, 종기, 농포
Blake n. 영국의 시인작가
blamable a. 비난할 만한
blame vt. n.  나무라다, 비난하다.. 의 탓으로 돌리다-비난, 책임, 허물
blamed a. 지긋지긋한, 빌어먹을
blameful a. 비난할 만한, 나무랄만한
blameless a. 나무랄만한
blamelessly ad.비난할 점이 없게;결백하게
blameworthy a. 나무랄만한
blanch vi. vt. 희게하다, 표백하다, 창백해지다
Blanche n. 여자 이름
blancmange n. 블랑쥬아(우유가 든 흰 젤리, 디저트용)
blanco n. vt. 백색 도료(벨트, 군화 등의 가죽 제품용, (가죽 제품에)백색 도표를 칠하다
bland a. 온화한, 부드러운, 기분 좋은, 상냥한, 순한
blandish vt. 아첨하다, 비위를 맞추다, 설득하다
blandishment n. 추종, 감언, (사람을 호리는)수단
blandly ad.(기후가)온화하게;(말 태도가)부드럽게;입에 맞게
blandness n.(기후가)온화함;(말 태도가)부드러움;입에 맞음
blank a. n.  vt. 백지의, 공허한, 흥미 없는, 단조로운, (벽따위)문이나 창이 없는, 무표정한, 멍한-백지, 기입 용지-비우다, 공백으로하다
blank cartridge n.공포탄(사격)
blank verse 무운시(약강오보격의)
blankbook n. 백지(미기입)장부
blank check x. 백지 수표(person a.~ 얼마든지 돈을 주다, 멋대로 하게 하다)
blanket n. a. vt. 담요, 모포-총괄적인, 차별하지 않는, 일률적인-담요에 싸다, (사건을)덮어 버리다(obseure), (전화를)방해하다, 숨기다
blanket area x. (방송국 주변의)난청구역
blanket bombing x. 융단, (무차별)폭격
blanket chest x. 이불장
blanketing n. 담요감, 전파 방해(강력 전파로 수신 불가능하게 하기)
blanket insurance x. 전종보험
blanket visa x. 일괄 사증(세관이 선객 전부에게 일괄하여 주는 비자)
blankety a. ad, 괘씸한, 괘씸하게도
blanketyblank n. 바보, 멍청이, 망할 놈(wretch)
blank form x. 기입 용지
blankly ad.멍하니, 우두커니, 딱잘라서, 완전히
blankness n. 공백, 단조
blank verse x. 무운시(보통 5각약강격)
blanquette n. 블랑켓(백소스로 조리한 송아지고기스튜)
blare vi. vt. n.  외치다, (동물이 굵은 소리로)울다-울리다-울림, 외치는(우는)소리치는 소리
blarney n. vi. vt. 알랑거리는 말, 말을 하다
blase a. 환락에 지친
blaspheme vt. vi. (신에 대하여)불경한 언사를 쓰다, 험담을 하다
blasphemer n. 불경스러운 말을 하는 사람, 모독자, 욕설하는 사람
blasphemous a. (사람이)불경스러운, (말, 내용등이)모독적인
blasphemy n. 불경, 모독
blassed a. 치우친, 편견
blast n. vi. vt. 돌풍, 한 바탕 부는 바람, 소리, 울려퍼짐-폭파하다, 시들게 하다
blast off vi.(로켓 미사일 등을)쏘아올리다;나가다
blastdown n. (로켓의)착륙
blasted a. 시든, 결단난, 저주받은
blastena n. 아주, 유배의 세포 집단
blaster n. 발파공, 블래스터(벙커용의 타면이 넓은 클럽, (SF소설에서)우주 총, 건, 건맨
blastfreeze vt. (냉각공기를 순화기켜)급속 냉동하다
blast furnace x. 용광로, 고로
blasting n. 폭파, 발파, (서리 등이 초목을)말림, (나팔등의)소리, 울림, 호된 꾸지람, 야단
blasto n. =BLAST
blastocyst n. 배반포, 낭포
blastoderm n. 배반엽, 포배엽
blastoff n. (로켓 등의)발사
blastomere n. 할구, 난할구
blastopore n. 원구
blast pipe x. 송풍(배기)관
blastula n. 포배
blast wave x. 폭풍
blastulae n.포배
blat vi. vt. (송아지, 양이)울다, 시끄럽게지껄이다
blatancy n. 소란함
blatant a. 소란스러운, 성가시게 참견하는, 야한
blatantly ad.소란스럽게;야하게;난하게;심히 눈에 띄게
blather vt. vi. n.  지껄여대다, 허튼소리, 허튼소리를 하다
blatherskite n. 허튼 소리를 하는 사람, 떠버리
blatter vi. vt. 귀찮게 발리 지껄여대다, 마구 수다떨다
blaxploitation n. (영화, 연국 등에서의)흑인 개발(흑인에 대한 관심을 개발시키기), 흑인 고객 유치 방안
blaze n. vi. 화염, 빛, 광휘, (명성의)드날림, (감정의)격발, -불타다, 빛나다, 불같이 노하다
blaze n. vt. 길잡이로 나무껍질을벗긴)안표
blaze vt. 포고하다(proclaim), (널리)알리다
blazer n. 블레이저코트(화려한 빛깔의 스포츠용 상의)
blazing a. 타는, 타는 듯한, 강렬한, 심한
blazing star x. 리아트리스속의 식물, 흥미의 대상(사람, 물건)
blazon n. vt. 문장, 문장묘사, 과시-문장을 그리다, 말을 퍼뜨리다, 공표하다
blazonment n.문장을 그림(해설);치장;과시;공표;떠벌려 퍼뜨림
blazonry n. 문장(해설, 화법), 화화한 겉치레, 미관
bleach vt. 표백하다, 마전하다, 노천 관람석
bleached a. 표백한
bleacher n. 표백하는 사람, 표백업자, 표백기(제), 지붕없는 관람석(대중석), 외양석
bleacherite n. 외야석의 구경꾼
bleachery n. 표백 공장
bleaching n. 표백, 표백법
bleak a. 황량한, 으스스 추운, 쌀쌀한, 쓸쓸한(dreary)
blear a. (눈이 눈물이나 염증으로)흐린, 침침한, 헌, 희미한(dim)
blear a. vt. 흐린, 침침한-흐리게하다
bleareyed a. 흐린 눈의, 눈이 잘 보이지 않는
bleary a. 눈이 흐린, 몽롱한
bleat vi. n.  (염소, 송아지 따위가)매애 울다, 매애
bleating n. 울음소리, 우는 소리
bleb n. 물집, 기포
bled v bleed의 과거 (분사)
bleed vi. vt. n.  출혈하다, 피흘리다, 슬퍼하다-(환자의)피를 뽑다, 돈을 우려내다-찍힌 부분까지도 자른사진, 인쇄된 부분까지도 자른 사진
bleeder n. 피를 잘 흘리는 사람, 혈우병자
bleedering n. 출혈, 방혈(bloodletting)
bleeding heart x. 금낭화
bleep n. 삐익하는 소리(휴대요 라디오 등에서 나는)-삐익 소리를 내다
blemish n. vt. 흠, 결점, 손상하다
blench vi. vt. 뒷걸음치다, 주춤하다, 휘어지다, 푸르게 하다
blench vi. vt. 희어(푸르러)지다, 희게(푸르게)하다
blend vi. vt. n.  섞이다, 융화하다, 조화하다, 혼합물
blend in vi.조화(조합)하다(시키다)
blende n. 섬아연광
blended a. (차, 담배, 술 등이)혼합된, 블렌드된, (직물이)혼방의
blended whiskey x. 블랜드위스키(보통 malt whiskey와 grain whiskey를 혼합한 것)
blender n. 혼합하는것, 믹서, 혼합하는 사람
blending n. 혼합(물), 혼성어
Blenheim n. 황금빛 사과, 삽살개의 일종
blenny n. 베도라치
blent v BLEND의 과거, 과거분사
bleomycin n. 블레오마이신(항생 물질, 폐암, 피부암 치료용)
blepharitis n. 안검염
blepharoplasty n. 안검 형성
blesbok n. 블레스복(얼굴에 크고 흰 반점이 있는 남아프리카산 영양)
bless vt. 정화하다, 찬미하다, 은총을 내리다, 수호하다
blessed a. 신성한, 복된, 축복을 받은, 행복한
blessedly ad.다행히도(happily)
blessedness n. 행운, 행복
blessing vt. (신의)가호, 은총, 축복, 식전(식후)의 기도, 행복, 고마운 것
blest v a. bless의 과거부사-=BLESSED
blether v n.  =BLATHER
blew v blow의 과거
blight n. vt. 말라죽는 병, 병균, 해충, 암영-말라죽게 하다, 파멸시키다
blighter n. 영국 본국, (제 1차 대전때)본국에 송환될 정도의 큰 부상, 귀국 휴가
blimey xint, 아차!, 아뿔싸!, 제기랄!, 깜짝이야!
blimp n. 소형 연식 비행선, 완고한 보수주의자
blind a. vt. n.  장민의, 눈먼, 맹목적인, 어리석은, 이성을 잃은, 숨은, 문, 막다른-눈멀게 하다, 속이다-블라인드, 커튼, 발, 차일
blind alley n.막다른 골목;가망 없는 국면(직업 연구 등)
blindage n. 방탄벽(참호 내의)
blind alley x. 막다른 골목, 막바지, 전도가 없는 형세
blind date x. (소개에 의한)서로 모르는 남녀간의 데이트
blinder n. 혼합물, 혼성어
blindfish n. 맹어(눈이 없는 물고기, 눈이 퇴화된 심해어)
blind flying x. 맹목 비행(레이다 따위의 계기에만 의존하는 비행)
blindfold vt. a. ad, 눈을 가리다, 어찌할 바를 모르게 하다, 속이다-눈이 가려진9가려져), 무모한
blindfoled vt. 눈을 가리다, 어찌할 바를 모르게 하다, 속이다, 눈이 가려진, 무모한
blinding n. 눈을 멀게 (부시게)하는, 현혹시키는, 새 포장 도로의 틈새기를 메우기 위한 모래, 자갈, 침상(mattress)
blind landing x. 계기착륙
blindly ad.맹목적으로, 무턱대고
blind man x. 장님
blindman n. 수신인 주소 성명 판독계원
blindman's buff x. 소경놀이
blindness n.눈이 멀음;맹목;무분별
blindpig x. 주류밀매점
blindreader n. =BLINDMAN
blind shell x. 불발탄
blindside vt. (상대의)무방비한 곳(약점)을 공격하다, 기습 공격을 감행하다
blind spot x. 맹점, 수신감도가 나쁜지역
blindstamp vt. (표지에)민누름하다
blindstitch vt. vi. 공그르다
blindstory n. 창문이 없는 층(교회당의 광선을 들어오게 하는 창 밑의 복도)
blindworm n. 발없는도마뱀
blinger n. 극단적인 것(사례)
blink vi. vt. n.  깜박거리다, 반짝거리다, 힐끔보다, 무시하다-깜박거림, 섬광
blinkard n. 눈깜작이, 얼간이, 바보
blinker n. 눈깜작이, 추파를 던지는 여자, (말의)눈가리개 가죽, 먼지 막는 안경(goggles), 눈, 명멸광(신호등)(경계표), (자동차의)방향 지시기, 깜박이(winkers)
blinking a. ad, 깜박거리는, 명멸하는, 어처구니 없는, 지독한(bloody), 지독하게, 굉장히
blintz n. 일종의즐은핫케이크
blintze n. 블린츠(치즈, 잼 등을 채워서 구운 팬케이크)
blip n. 영상, 레이더의 영상
blisery a. 물집이 있는, 물집투성이의
bliss n. 더없는행복, 지복
blissful a. 행복한
blissfully ad.더 없이 행복하게;기쁨이 가득하게;깨끗이 있게
blister n. vi. vt. 물집, 물집이생기다, 돌출부, 중상하다
blister copper x. 조동
blistering a. 물집이 생기게 하는(듯한), 타는 듯한, (비평이)신랄한, 통렬한, 격렬한, 비난하는, 창피를 주는
blithe a. 명항한, 쾌활한, 유쾌한, 행복한
blithely ad.즐겁세;쾌활하게;경솔하게;부주의하게
blithering a. 수다스러운
blithesome a. =BLITHE
blitz n. vt. 전격전을가하다, 급습하다
blitzed a. 술에 취한(drunk)
blitzkrieg n. 전격전
blizzard n. 심한눈보라
bllowy a. 너울의, 물결이 높은
bloat vi. vt. 부풀리다, 자부하다, 훈제하다
bloated a. 부풀은, 우쭐대는
bloater n. vt. 훈제한 청어, (청어를)훈제하다
blob n. vi. vt. 한방울, 작은 얼룩점, 영점-뚝하고 듣다, 떨어지다, 튀다
blobb vt.vi.~에 얼룩을 묻히다;한방울 튀기다;실수하다
blobberlipped a. 입술을 두껍게 내민(사람 등)
bloc n. 권한, 권, 블럭
block n. vt. 덩어리, 받침, 모탕, (시가의)한 구획, 한 장씩 떼어 쓰게 된 것, 불록(한 단위로 취급하는 연속된 언어의 집단)-방해하다, 막다, 봉쇄하다
block in 막다;폐색하다;가두다;약도를 그리다;설계(계획)하다
block letter n.목판 글자;블록 그자체(굵기가 같음)
block up (길을)막다;방해하다;받침대 위에 올려놓다
blockade n. vt. 봉쇄, 폐쇄, 교통차단, 경제봉쇄
blockader n. 봉쇄하는 사람(것), 폐색선
blockaderunner n. 봉쇄 돌파시(선), 밀항자(선)
blockage n. 봉쇄, 방해, 저해, 방해물, (파이프 등에)막혀 있는 것
blockball n. 장애구
blockboard n. 합판, 베니어판
blockbust vt. (백인 부동산 소유주에게)blockbusting을 하다
blockbuster n. 고성능대형폭탄
block diagram x. 장치부품배치도표
blocked a. 막힌, 폐색된, 봉쇄된, 마약에 취한
blockfront n. (책상, 장롱 등의)중앙이 양끝보다 쑥 들어간 정면, 가구(블록)의 정면
blockhead n. 바보
blockhead n. 멍청이, 얼간이, 아둔패기
blockhouse n. 토치카, 작은 목조 요새, 로켓발사 관제소
blockhouse n. 작은 요새, 토치카, (옛날의)통나무 방책, (로켓 기지 등의)철근 콘크리트 건물(열, 돌풍, 방사능 등을 막는)
blocking n. 오리대(틈을 메우는 나뭇조각), 블로킹, 저지 현상(바람직하지 않은 상념에 의한 연상 중단), (배우의)연출, 블로킹하기
blockish a. 목석같은, 어리석은
block letter x. 블럭자체
block letter x. 블로 자체
block printing x. 목판인쇄
block printing x. 목판 인쇄
blockship n. (항구, 항로를 사용 불능케 하려고 침몰시키는)폐색선
blocky a. 뭉툭한, 농담의 채가 있는
bloke n. 놈(fellowchap)
blond a.금발의 n.금발에 피부가 흰 사람
blonde a. n.  블론드의사람, 금발 흰 피부의 사람
blondie n. 금발(블론드)의 여자, 블론디(만화의 여주인공, 남편은 Dagwood)
blood n. 피, 혈액, 혈통, 순종, 살육
blood and iron n.군사력
blood bath 피의 숙청;대학살
blood brother 친형제;(혈맹의)의형제;(흑인 입장에서 본)동포;흑인
blood donor 헌혈자;급혈자
blood group 혈족;혈액형
blood heat (사람의)피의 온도(평균 37도)
blood poisoning 패혈증
blood pressure 혈압
blood relation 혈족;육친
blood test 혈액 검사
blood transfusion 수혈(법)
blood vessel 혈관
bloodandguts a. 끔찍한, 지독한(적개심), 피비린내 나는 (이야기)
bloodandthunder a. 폭력과 유혈의, 살벌한, 저속한(소설, 영화 등)
blood bank x. 혈액은행
blood bath x. 대학살
blood brother x. 친형제, 피로서 맺은 형제
blood cell x. 혈구
blood clot x. 혈병, 혈괴
blood count x. 혈구수측정
bloodbath 피의 숙청;대학살
bloodcurdler n. 센세이셔널한 이야기(기사, 책 등)
bloodcurdling a. 소름끼치는
blood donor x. 헌혈자
blooded a. ..혈의, ..기질의, 순혈의, 전투를 경험한 (군대), 새로운 경험을 쌓은
bloodgiven a. 혈연에 의한, 동족의
blood group x. 혈액형
bloodguilt n. 유혈의 죄, 살인죄
bloodguilty a. 사람을죽인
blood heat x. 혈온(인간의 표준 체온, 보통 37도)
bloodhorse n. 순종의말
bloodhound n. 경찰견, 탐정
bloodily ad.피투성이가 되어, 참혹하게, 무참하게
bloodiness n. 피투성이, 잔인
bloodless a. 핏기가없는
bloodletting n. 방혈, 유혈
bloodline n. 혈통, 혈족
bloodlust n. 유혈에의욕망
bloodmobile n. 피흘리지 않는, 무혈의, 기운 없는, 무정한
blood money x. 살인사례금, (적기를 격추한 자에게 주는)공로금, 위자료
blood poisoning x. 패혈증
blood pressure x. 혈압
bloodrags n. pl, 월경
bloodred a. 피처럼 새빨간, 피로 물들인
blood relation x. 혈족
bloodroot n. 양기비과의식물
blood royal x. 왕족
bloodshed n. 유혈, 참사
bloodshot a. 충혈된
bloodstain n.핏자국;혈혼
bloodstained a. 피묻은, 살인을 한
bloodstock n. 순종의말
bloodstone n. 혈옥수
bloodsucker n. 흡혈귀, 고혈을 빠는 사람, 식객
blood test x. 혈액검사
bloodtest vt. 혈액 검사를 하다
bloodthirsty a. 피에굶주린
blood transgusion x. 수혈법
blood vessel x. 혈관
bloodwarm a. 혈온의, 뜨듯한
bloodworm n. 붉은 지렁이(낚시 밥용)
bloodworm n. 붉은지렁이
bloody a. vt. 피투성이의, 잔인한, 피의, 심한, 피투성이를 만들다
bloody mary x. 보드카와 토마토쥬스를 섞어만든 칵테일
bloodyminded a. 냉혹한, 살벌한, 잔인한, 심술궂은, 비뚤어진, 괴팍한
blooey a. 고장난
blooie a.고장난
bloom n. vi. 꽃, 개화기, 건강한-피다, 번영하다
bloom n. 쇳덩이
bloomary n. =BLOOMERY
bloomed a. (렌즈가)코팅된(coated)
bloomer n. =BONER
bloomers n. pl, 블루머, (여자 소녀용의 운동용 팬츠)
bloomery n. 괴철로, 괴철공장
Bloomfield n. 블룸필드(1887-1949)(미국의 언어 학자
blooming a. 활짝핀, 한차인, 번영하는, 지독한, 어처구니없는
bloomy a. 꽃이 만발한, (과실 등이)흰 가루가 생긴, 청춘의, 꽃피는, 젊고 아름다움과 힘에 넘치는
bloop vt. 텍사스히트를치다
blooper n. 큰실수, 역회전의 높은공, 텍사스 히트
bloshevism n. 과격주의사상
blossom vt. n.  꽃, 청춘, 피다, 번영하다
blossomy a.꽃이 한창인;꽃으로 두덮인
blot n. vt. (잉크 따위의)얼룩, 때, 오점, 오명, 결점-더럽히다, 지우다, 감추다
blotch n. 얼룩, 종기, 점
blotched a. 얼룩진
blotchy a. 부스럼(얼룩)투성이의
blott vt.더럽히다;~을 얼룩지게 하다;빨아들이다;뒤바르다
blotter n. 압지, 기록부
blottesque n. 마구 그린, 조잡하게 만든 (예술품 등)
blotting paper x. 압지
blotto a. 곤드레만드레취한
blouestone n. 황산동, 푸른돌(청회색의 바닥돌, 건축재료)
blouse n. 블라우스(여자, 어리이용의 셔츠의 웃옷), 군복의 상의
blouson n. 여성용재킷(허리 부분을 고무나벨트로 대어 불록하게 되도록 한옷)
bloviate vi. 거침없이 장황하게 말하다
blow vi. vt. n.  불다, 바람에 날리다, 휘몰아치다, 한번 불기, 취주, 개화, 타격, 강타
blow away (불어)날려버리다;날리다;흩뜨리다;떠나가다;사살하다
blow down 불어 쓰러뜨리다(떨구다);(보일러의 증기를)배출하다
blow in (바람이)들어오다
blow off (모자 따위를)바람에 날리다;불어 날려버리다
blow one's top 불같이 노하다;미치다;자살하다;멋대로 지껄이다
blow out (바람이)그치다;(불 등을)끄다;끊어지다;부풀다
blow over (폭풍 따위가)지나가다;멎다;잠잠해지다;잊혀지아
blow up (바람이)일다;(폭풍이)심해지다;폭파하다;파산하다
blowball n. 관모구(민들레 등의 솜털이 붙은 열매)
blowby n. 블로바이(피스톤과 실린더 사이의 가스 누출)
blowbyblow a. 상세한
blowdry n. (머리를)드라이어로 매만지다, 블로 드라이(드라이어로 머리를 매만지기)vt. n.  
blower n.부는 사람;송풍기장치
blowfish n. 몸을 부풀리는 고기(복어 등)
blower n. 부는사람, 송풍기, 유리부는 사람
blowfly n. 금파리
blowgun n. (불어서 화살을 쏘아 보내는 남미 인디언 등의)취관, 분무기
blowhard n. 허풍선이
