a a. 하나의, 어느 하나의, 어떤(a. certain), 같은
a few 조금은 있는
a fond 충분히;철저하게
a fortiori 한층 유력한 이유로;더욱 더
a good many 상당히 많은
a great many 굉장히 많은
a la mode 유행의;유행을 따라서;아이스크림을 친 파이
a little 조금은;적으나마
a lot of 많은(=lots of)
a-frame a. n.  a(자)형의, A형 틀(무거운 물건, 호이스트, 샤프트, 파이프 등을 받치는 데 씀)
a-sub n. 원자력 잠수함
a.B.S. x. American Bible Society, absent absolute(ly) abstract
a.C.I.S. x. Associate of the Chartered Institute of Secretaries
a.C.L.S. x. american council of learned societies
a.C.U. x. =Autocycle Union
a.E.R.E. n. Automatic Energy Research Establishment, 원자력 연구소
a.d. 그리스도기원;서기(Anno Domini의 약자)
a.m. 오전;상오(ante meridiem의 약자)
a.n.. Other n. 익명씨, 선수 미정
a.V.C. n. American Veterans' Committee미국 재향 군인회
aardvark n. 땅돼지, 남아프리카산 땅돼지
Aaron n. 아론(모세의 형, 유태교 최초의 제사장)
Aaron's beard x. 물레나물, 범의귀 따위의 속명
Aaron's rod x. 식물 미역취 따위의 속명
ab n.학사(Artium Baccalaureus;혈액형
aba n. 염소털로짠옷감, (아라비아인의)소매 없는 긴 겉옷
abac n. 계산도표, 조견도표
abaca n. 마닐라삼
abaci n.abcus의 복수형
aback ad.뒤로, 후방으로, 돛이 거꾸로, be taken~ 뜻밖에, (느닷없이)당하다, 깜짝 놀라다
abacus n. 수판, 주판, (둥근 기둥의)대접받침
abaddon n. 지옥, 나락, (=apollyon)
abaft ad.prep. 뒤로, 뒤에, 고물(선미)에(aft)
abalone n. 전복
abampere n. 절대 암페어, 10암페어(전류위 cgs 전자단위)
abandon 1)버리다, 버려두다, 단념하다, 2)내맡기다, (집, 동네를)떠나다, 3)유기하다(술)에 젖다, (절망)에 빠지다
abandoned a.버림받은;방탕한;파렴치한
abandonee n. (유기 자산의)피위부자
abandoner n.유기자;위부자
abandonment n.포기
abas n.(그리스 신화)아바스
abase vt. 낮추다, (지위나 품위를)떨어뜨리다(degrade), 창피를 주다
abasement n.(품위의)실추;굴욕
abash vt. 부끄럽게 하다, 당황케 하다(=embarrass)
abashment n.수치;곤혹
abasia n. (뇌중추 장애 등에 의한)보행불능증
abate vt. 1)할인하다, 내리다, 할인하다, 덜다, 누그러뜨리다2)줄다 약해지다, 누그러지다
abatement n.인하
abatis n. 가시울타리, 철조망
abattis n.녹채;가시 울타리;철조망
abattoir n. 도살장, 공설도축장
Abba n. 아버지(기도에서의 하나님, 마가 XIV:36)
abb n.애브(저급 털 섬유);씨실
abbacy n. 대수도원장의 관할구역, 대수도원장의 직(임기)
abbatial a. 대수도원(장)의, 대수녀원장의
abbe n. (프랑스의)대수도원장, 신부
abbess n. 여자수녀원장(CF, ABBOT)
abbey n. 수도원
abbot n. 수도원장
abbotcy n.대수도원장의 직(권);대수도원장의 임기(=abbacy)
abbotship n.대수도원장의 직(권);대수도원장의 임기(=abbacy)
abbreviate vt. 줄이다, 단축하다
abbreviation n. 생략, 약어, 약자
ABC n. =alphabet;초보, 입문서
ABCC Atomic Bomb Casualties Commission x. 원폭 상해 조사 위원회
abdicate vt. (권리, 지위를)버리다, 퇴위하다, 퇴관하다
abdication n. 사직, 퇴위, 퇴관
abdicator n. 포기자, 퇴위자, 양위자
abdomen n. 배, 복부
abdominal a. 복부의
abdominous a.올챙이배의
abducent a.(근육 등이)외전인
abduct vt. 유괴하다, 외전시키다
abduction n.유괴;탈취
abductor n. 유괴자, 외전근
Abe n. 아브라함의 통칭
abeam ad.(배위 용골에)가로로(선채와T자를이루어)
abecedarian n. 초학(심)자, 초보의, 기본의, 아무것도 모르는
abed ad.잠자리에
Abel n. 아벨(아담의 둘째아들, 형 가인에게 살해됨)
Aberdeen n. 스콜틀랜드의 동북부도시, 스모치테리어개
abele n.사시나무
abelmosk n.닥풀속의 상록 관목
aberdevin n. 검은방울새(유럽산)
aberrance n. 탈선, 과오
Aberdonian a. 에버딘의사람
aberrancy n. 탈선, 과오
aberrant a. 정도를(바른 길을) 벗어난, 탈선적인
aberration n. 바른 길을 벗어남, 정신 이상, (렌즈의)수차
abet vt. 부추기다
abetment n.교사;선동
abetter n.교사자;선동자
abettor n.교사자;선동자
abeyance n. 중절, 정지
abhor vt. 몹시 싫어하다, 혐오하다(detest)
abhorrence n. 혐오, 아주 싫은 것, 싫은(to me), 몹시 싫은(OF IT), 서로 용납치(맞지)않는(TO, FROM)
abhorrent a.몹시 싫은;지겨운;서로 용납 안 되는;상반되는
abidance n. 지속, 거주, 체재, (..의)준수
abide vi. 머무르다, 살다, 지탱(지속)하다
abide by x. (약속, 결의 따위를)굳게 지키다, 따르다, 규칙을 엄수하다
abiding a. 영속적인
abidingly ad.영속하여;변치 않고
abigail n. 시녀, 몸종
ability n. 능력, 수완(to do), 재능
abiochemistry n. 무기화학
abiogenesis n. 자연발생론
abiogenetic a.자연 발생(론)의
abiogenist n.자연 발생론자;우발론자
abiotic a. 생명(생물)에 관계없는, 비생물적인
abirritant n. a. 진정제, 자극완화제(의)
abject a. 비참한, 비열한
abjection n. 영락, 비열함
abjectly ad.비열함
abjure vt. 맹세코 그만두다, (주의, 의견 등을)버리다
ablactation n.젖떼기;이유
ablate vt.vi.제거하다
ablation n. 제거, 삭마, (로켓)융제(우주선의 대기권 재돌입시 피복 물질의 녹음)
ablative n. a. 탈격(의), ~absolute 탈격 독립구
ablator n. 융제물질
ablaut n. 모음전환(gradation)(보기:sing-sang-sung)
ablaze ad.불타올라, 격하여, set~ 불태우다
able a. 재능 있는, 유능한, 능란한, 자격이 있는, ..할 수 있는, be~to(do)~할 수 있다 , -ible()suf. 기능을 나타내는 형용사를 만듦, admirable, comfort-able, accessible, sensible
ablebodied a. 강건(강장)한, 튼튼한(an...seaman)적임(일등)선원
abloom ad.a. 꽃이 피어
ablush ad.a. 얼굴을 붉혀
ablution n. (몸을)깨끗이 씻음, 목욕 재계, 깨끗이 씻는 물
ably ad.훌륭히, 교묘히
ably ad.훌륭히, 교묘히, 유능히
ABM n. 탄도탄요격 미사일(Atomic Bomb Mission 원폭 조사 위원회
abnegate n. (권리 등을)버리다, 자제하다, (쾌락 등을)끊다
abnegation n.거절;기권;극기;자제
abnormal a. 비정상인, 이상의, 변태의, 변칙의(~psychology 이상 심리학)
abnormality n. 이상, 변칙, 병신, 불구
ABO n. 혈액조직ABO분류법
Abo-o, ab-o n. =ABORIGINAL
abnormally ad.보통과 다르게;변태적으로
abnormity n.이상;변칙;이형;기형
abo n.a.원주민(의)
aboard ad.prep. 배 안에(로), 차내에(로)
abode v n.  abide의 과거(분사), 거주, 주거, 체류
abolish vt. a. n.  폐지하다, 철폐하다(~.a..ble, ~ment)
abolishable a.철폐(폐지)할 수 있는
abolishment n.폐지
abolition n. 폐지, 노예 폐지(~ism)(노예)폐지론, ~ist(노예)페지론자)
abolitionist n.(노예)폐지론자
abomasum n. 동물의 추위(반추 동물의 제 4위)
Abomb n. 원자, 고속용으로 개조한 중고차(hot rod)
abomasus n.(반추 동물의)제4위;주름위;취위
abominable a. ad, 싫은, 지겨운, 지독한, the~snowman(히말라야의)설인, -bly 미울 정도로, 지겹게
abominably ad.가증스레;몹시;지독히
abominate vt. 혐오하다, 몹시 싫어하다
abomination n. 혐오, 증오, 싫은 일
aboriginal a. n.  처음부터의, 원주의, 토착민의, 원주민, 토인, 토착의 동식물
aboriginally ad.당초부터;원래는
aborigines n. 원주민, 토착민
aborning ad.태어나려하고 있는, 수행되기 전에
abort vi. n.  1)유산하다, 조산하다, 실패하다, 발육이 안된 채 끝나다, 로켓비행이 중단 되다, 프로그램 실행의 중지
aborticide n.낙태;낙태약
abortifacient n. a. 낙태약, 유산을 촉진하는 
abortion n. 유산, 조산, 유산아, 낙태, 실패, 기형물, 불구 발육부전, (artificial~인공 유산, ~ist 낙태의)
abortionist n.낙태 시술자;낙태 지지자
abortive  a. 유산의, 조산의, 실패의, 발육부전의
abortively ad.유산적으로;실패적으로
abought v.aby의 과거,과거분사
aboulia n. =abulia
abound vi. a. ad, ..이 많다(Trout~in this lake=This lake~s with trout 이 호수에는 송어가 많다)(~ing, ~ingly)
about prep. ad, a. vt. ~에 대하여, ~의 주위에, ~의 여기저기에, 대략, 약, ~경에, ..의 둘레에, 도처에, 병이 돌아서 , 소문등이 퍼저서
aboutface vi. n.  뒤로 돌다(돌기), (사상 따위)전향하다, 전향
above prep. ad, a. n.  ~보다 위에, ~을 넘어, ~보다 윗자리에
above all 특히 그중에서도
aboveaverage a. 평균을 넘는, 보통 아닌, 괜찮은
aboveboard ad.pred. 있는그대로의, 공명히
abovedeck ad.a. 갑판 위에서, 공명정대하게, 있는 그대로
aboveground ad.지상에, 매장되지 않은, 생존하다
abovementioned a. 상술한, 위에 말한
abovestairs ad.a. 위층에
abovo ad.(L.=from the egg) 처음부터
Abp x. archbishop
abracadabra , 이마를 삼각형으로 그듭쓴(병 예방의)부적, 주문, 뜻 모를 말(gibberish)
abrachia n. 결여(증), 상지(의학용어)
abractness n. 추상성
abradant a.(문질러)벗기는;닳게 하는 n.연마제(=abrasive)
abrade vt. vi. 닳리다, 문대어 벗기다, 신경질나게하다
abrader n. 연삭기
Abraham n. 남자 이름, 아브라함(유태인의 조상)
Abrahamman n. 가짜로 미치광이 짓을 하며 다니는 거지(영국에서)
Abram n. 남자이름, 아브람
abranchiate n. 아가미없는(동물)
abraser n. =ABRADER
abrasion n. 벗겨짐, 문질러 닦음, 찰과상, 마멸(된곳)
abrasive a. 연마의, 꺼칠꺼칠한, 마찰 있는(인간관계), 피부를 긁히는
abreact vt. 정화하다(억압된 감정을), ..을 해제하다
abreaction n. (억압 감정)해방, 소산
abreast ad.나란히, 어깨를 나란히 하여, keep~of(with)(the times)(시세)에 뒤지지 않고 따라가다
abridge vt. 1)단축하다, 적요하다, 간추리다, 줄이다2) ..으로부터 ..을 빼앗다(deprive)
abridgement n. 요약본, 초본, 적요, 축소, 단축, 요약
abroach ad.pred. a. (통의)마개를 따고, 퍼져서
abroad ad.
abrogate vt. (법률, 습관 등을)폐기하다
abrogation n. 폐지
abrogative a. 폐지(폐기)의
abrogator n. 폐기자, 철회자
abrupt a. 느닷없는, 험준한, 퉁명스러운, (글의 앞뒤가)동일하지 않는
abruption n. (급격한)분열, 분리
abruptly ad.갑자기(=suddenly), 뜻밖에, 퉁명스럽게, 무뚝뚝하게
Absalom n. 압살롬(다윗의 셋째 아들, 부왕을 배반했음)
abscess n. 종기, 농양
abscessed a. 종기가 생긴
abscind vt. 절단하다, 잘라내다
abscise vt. vi. ..절단하다, 절제하다
abscissa n. 횡선, 가로 좌표
abscissae n.abscissa(가로좌표)의 복수형
abscission n. (수술에 의한)절단, 절제, 갑작스런 중단
abscond vi. n.  도망하다(~with the money 돈가지고 도망치다) ~enc 도망, 실종
abscondence n. 도망, 실종
abseil n. vi. (자일을 쓰는)현수하강, 현수하강을 하다
absence n. 부재, 결석, 결핍, 없음(of), 방심(~of mind 방심, in the~of ..이 없기 때문에, 이 없을 경우에)
absent a. ad, 부재의, 결석의, 없는, 멍청한, 결석시키다(~oneself from ..을 비우다, 결석하다), ~ad 멍하여, 멍하게
absentee n. a. 부재자, 부재지주, 부재투표자의(를위한)(~ism부재지수제도)사보타즈전술
absentee ballot x. 부재 투표 용지
absenteeism n. 부재지주 제도, 장기 결석, 계획적 결근
absentee voter x. 부재 투표자
absentee voting x. 부재자 투표
absently ad.얼빠져, 넋을 잃고
absentminded a. ad, 방심 상태의, 멍(청)한(~ly)
absentmindedly ad.건성으로;얼빠지게;한심하게
absinth n.압상트(프랑스산 독한 술)
absinthe n. 압생트(독한술)
absinthism n. 압생트중독(술)
absitomen int, (제발)이것이 흉조가 아니길! 맙소사 맙소사
absolute a. 절대의, 순수한, 무조건의, 전제의, 절대온도(고도)의, (컴퓨터)기계어로 쓰인
absolute alcohol x. 무수 알코올
absolute altitude x. 절대 고도
absolute ceiling x. 절대 상승 하도(안전 비행이 가능한)
absolute construction x. 독립 구문
absolute humidity x. 절대 습도
absolute infinitive x. (participle)독립 부정사(분사)
absolutely ad.아주 맞았어, 그래
absolute magnitude x. 절대 등급
absolute majority x. 절대 다수
absolute monarchy x. 전제 군주 정체
absolute music x. 절대 음악(표제 음악에 대해서)
absoluteness n. 
absolute pitch x. 절대 음고(음감)
absolute temperature x. 절대 온도
absolute value x. 절대값
absolute zero x. 절대 영도(-273도)
absolution n. (회개한 자의)면죄, 책임 해제
absolutism n. 전제주의, 독재 정치
absolutist n. 절대론자, 전제정치론자, 전체주의자
absolutize vt. 절대화하다
absolve vt. 방면하다, 사면하다, 무죄를 언도하다
absonant a. 조화되지 않는
absorb vt. 흡수하다, 병합하다, 동화하다, (흥미로)이끌다(be~ed by ..에 흡수(병합)되다
absorbability n. 흡수됨, 피흡수성
absorbable a. 흡수되는, 흡수되기 쉬운
absorbed a. 마음을 빼앗긴, 열중한, 여념 없는
absorbedly ad.열중하여
absorbefacient a. n.  흡수성의, 흡수제
absorbency n. 흡수성
absorbent a. n.  흡수성의, 흡수제
absorbent cotton x. 탈지면
absorbent cotton x. 탈지면
absorbing  a. 흡수하는, 흥미진진한
absorbingly ad.열중케 할 정도로;열광적으로
absorptance n. 흡수율(비)
absorption n. 흡수, 몰두
absorption band x. 흡수대
absorption spectrum x. 흡수 스펙트럼
absorptive a. 흡수하는, 흡수력 있는, 흡수성의
absquatulate vi. 뺑소니 치다, 종적을 감추다
abstain vi. n.  끊다, 자제하다, 삼가다(from), 금주하다(~ern)절제가, 금주가
abstainer n.절제가;금주가
abstemious a. 절제하는, (an~diet)절식
abstemiously ad.절제하여
abstention n. 절제, 자제(from), 기권
abstentious a. (술을)끊은, 절제하는
absterge vt. 씻어내다(없애다), 깨끗이 하다
abstergent a. n.  세척력이 있는, 깨끗이 하는, 세제
abstersion n. 세정, 청정화
abstersive a. 께끗이 하는, =ABSTERGENT
abstinence n. 금욕, 절제, 금주
abstinency n.절제;금욕;금주;금육재
abstinent a. 절제하는, 금욕적인, 금주하는
abstracism n. 추상주의
abstract a. 추상적인, 공상적인, 심원한, 방심한, 추상파의
abstracted a. 추상된, 추출된
abstracter n. 추출하는 사람(물건)
abstraction n. 추상, 추출, 추상파의 작품, 방심, 절취
abstractionist n.추상파 화가
abstractionmonger n. 공상가, 얼빠진 사람
abstractive a. 추상적인, 추출력 있는, 초록의
abstractly ad.추상적으로
abstract noun x. 추상명사
abstruse a. 난해(심원)
abstrusely ad.심원하게;난해하게
abstrusity n. 난해(함), 난해한 것(점)
absurd a. 불합리한, 모순된, 어리석은
absurdism n. (문학, 연극 등의)부조리 주의
absurdity a. 부조리한, 엉터리없는 일(것 이야기)
ABU n. 아시안방송연합
absurdly ad.불합리하게;엉터리로
absurdness n.불합리;부조리
abubble a. 거품이 일어나는, 뒤끓는, 동요(흥분)하는
abuilding a. 건축(건설, 건조)중인
abulia n. (마음)의지상실
abundance n. 풍부, 윤택, 다수, 부유, 충분한 물자 공급
abundant a. ad, 풍족한, 남아돌 정도의(-dantly)
abusage n. 말의 오용
abuse vt. n.  남용하다, 악용하다, 학대하다, 욕하다, 악용, 남용, 학대, 욕(설), 악습, 폐해 
abusive a. 입 사나운
abusively ad.매도적으로;학대적으로
abusiveness n.욕;매도;학대
abut vt. vi. 인접하다(on, upon), 기대다(against)
abutilon n. 어저귀속의 식물
abutment n. 인접, 접합부, 홍예받침대
abuttal n. 인접, 경계
abutter n. 인접 지주, 인접된것
abutting a. 인접한, 접경한, 건축에서 홍예받침대 구실을 하는
abuzz a. 와글와글, 활기 넘쳐
abvolt n. 전자단위 기호
abwatt n. 절대 와트
aby vt.(죄를)씻다;(괴롬을)견디다
abye vt.(죄를)씻다;(괴롬을)견디다
abysm n. 심연, 심원, 끝없이 깊은 지옥, 나락
abysmal a. 한없이 깊은, 심연의, 나락의, 지독히 나쁜
abyss n. (밑이 없는의 뜻에서)심연, 나락, 지옥, 혼돈
abyssal a. (해면에서 300길이 넘는)깊은 바다의, 바닥을 알 수 없는
Abyssinia n. 아비시니아
Abyssinian a. n.  아비시니아의, 아비시니아 사람, 아비시니아 말
AC DC x. ac dc alternating current direct current 교류, 직류의, 교직양용의, 양성에의
acacia n. 아카시아
academe n. 학구적 생활, 학자 생활, 학구, 학자연하는 사람
academese n. (딱딱한)학자풍의 문체(용어)
academia n. 학자의 세계
academic a. 학문의, 대학의, 학구적인, 비현실적인, 인문과의, 일반 교양적인, 형식존중의, 진부한, (Academic)플라톤 학파의
academical n. 대학의 예복과 예식용 모자, 대학생의 정장
academic costume x. 대학 예복
academic freedom x. 학문의 자유
academician n. 아카데미(학회, 학술원, 미술원)회원
academic interests x. 학교 경영 단체
academicism n. 예술원풍, 형식주의
academic year x. 학년(도)
academism n. 예술원풍, 형식주의
academy n. 학원, 사립의 고등 학교, 전문 학교, 학회, 아카데미아(플라톤이 철학을 강의한 아테네 근교의 올리브 숲)
Academy award n. 아카데미상(영화)
academy board x. (유화의)판지캔버스
Acadia n. 캐나다 남동부
Acadia n. 캐나다 남동부의 지방
acaleph n. 해파리의 일종
acanthoid a. 가시 모양의, 가시가 있는
acanthus n. 아칸서스, 아칸서스 잎 장식(그리스 건축의 주두)
acappella a. 무반주 음악
acariasis n. 진드기(기생)증
acarid n. 진드기
acarpous a. 열매 맺지 않는
acatalectic a. 행 끝의 시각이 완전한, 완전운각의
acatalepsy n. 불가지론(철학)
accede vi. 취임하다(앉다)(to) , (요구에) 동의하다, 따르다, (조약 따위에) 참가하다
accedence n. 
accelerando ad.a. 점점 빠르게, 빠른
accelerant n. 촉진제, 촉진
accelerate vt. vi. 빨리하다, 빨라지다, 속도를 늘리다
accelerated a. 속력이 붙은, 가속된
acceleration n. 가속, 촉진, 가속도
accelerative a. 가속의
accelerator n. 가속장치, 촉진제
accelerometer n. 가속도계
accent n. vt. 악센트(부호), 강조, 어조, 말투, 사트리, 음성, 말, 시구, ..에 악센트를 두다;(음색체 따위를)강하게 하다
accentual a.악센트의;음의 강약을 리듬의 기초로 삼는
accentuate vt. ..에 악센트를 두다, 악센트 부호를 붙이다, 두드러지게 하다, ..을 역설하다
accentuation n. 음의 억양법, 악센트를 붙이는 법, 강조, 역설, 두드러지게 하기
accept vt. 받아들이다, 떠맡다, 용인하다
acceptability n. 수락할 수 있음, 응낙, 만족, 용인성
acceptable a. 받을 수 있는, 좋은
acceptably ad.기꺼이 받아들일 수 있게;마음에 들도록
acceptance n. 수령, 어음의 인수
acceptant a. n.  (..을) 기꺼이 받아들이는, 받아들이는 사람, 수락자
acceptation n. 받아들임, 신앙
accepted a. 일반적으로 인정된, 용인된
accepter n. 받아들이는 사람, 수락자, 수납자
accepting n. (런던의)어음 인수 상사
acceptive a. 받아들일 수 있는, 받아들이는
acceptor n. 어음 인수인
access n. 접근, 발작, 부가, 증가(be easy of~ 접근(가까이)하기 쉽다, gain~to ..에 접근하다, 가까이하기 쉬운 사람
accessary a. n.  =ACCESSORY 부속의
accessibility n. 
accessible a. 접근(가까이)하기 쉬운, 얻기 쉬운
accessibly ad.접근하기 쉽게;이해하기 쉬운
accession n. 접근, 도달, 취임, 계승, 상속, 증가(물), (도서관의)수납도서, (종업원의)신규 채용
accession number x. 도서수납번호
accessorial a. 보조의, 종범의
accessorially ad.보조적으로
accessorily ad.보조적(종속적)으로
accessorize vt. vi. (부속품, 액세서리를)공급하다, 비치다, (의복에) 액세서리를 달다
accessory a. n.  부속의, 보조의, 종범의, 부속물, (여성의)악세사리, 종범자
access road x. (어느 시설에의)진입로
access time x. 호출시간(기억 장치에 정보를 기록, 해독케 하기 위한 시간), 컴퓨터용어
accidence n.어형변화(론);초보;입문
accident n. 우연히 일어난 일, 사고, 재난
accident insurance 상해 보험
accidental a.우연의 n.우발적인 사물
accidental colors x. 보색잔상으로 일어나는 색
accidental error x. 우연오차
accidental insurance x. 상해보험
accidentally ad.우연히, 뜻하지 않게
accidentprone a. 사고를 일으키기 쉬운
accidie n. 게으름, 무위
accipiter n. 매의 총칭, 매, 맹금
accipitral a. 새매(매)같은, 맹금성의
acclaim n. vt. vi. 갈채, 환호, 갈채를 보내다, 갈채하다
acclamation n. 환호, 갈채, 환호투표
acclamatory a. 순화하는
acclimatable a. 풍토에 순응시킬 수 있는
acclimate vt. vi. 풍토에 순화시키다
acclimation n. 새 환경 순응, 새 풍토 순화
acclimatization n. =ACCLIMATION
acclimatize vt. =ACCLIMATE
acclivity n. 치받이
acclivous a. 치받이의, 비탈진
accolade n. 칭찬, 명예, 나이트작 수여식
accommodate vt. 적응시키다, 조절하다, 화해시키다, 공급하다, 빌려주다, 숙박시키다, 수용하다
accommodating a. 친절한, 잘 돌봐주는, 붙임성 있는, 싹싹한, 융통성 있는, 고분고분한
accommodation n. 적응, 순응, 화해, 조정, 융통, 대부금, 편의, (호텔, 병원, 선박 등의)숙박 설비
accommodation bill x. 융통어음
accommodation ladder x. (배, 여객기의)트랩, 승강계단
accommodation load x. 특설도로
accommodation train x. 완행열차
accommodation unit x. 주택, (관청용어)
accommodative a. 필요에 대응하는, 적응적인
accommodator n. 적응자, 조정자, 융통해 주는 사람, 임시고용(파트타임)의 가정부, 파출부
accompaniment n. 수반하는 물건, 반주
accompanist n.동반자;반주자
accompany vt. 따르다(be accompanied by a. person with a. thing), 반주하다
accompanying a. 따르는(징조 등), 동봉(첨부)한 (편지 등)
accompanyist n.동반자;반주자
accomplice n. 공범자, 동류
accomplish vt. 완수하다, 성취하다, 달성하다, (학문과 기예를) 가르치다
accomplish a. 완성한, 숙달한, 소양(교양)이 있는
accomplishable a. 이룰 수 있는, 완성(성취)할 수 있는, 습득할 수 있는
accomplished a. 성취(완료, 완성)된, 뛰어난, 능란한, 조예가 깊은, 교양이 있는, 세련된
accomplishment n. 성취, 완성, 수행, 실행, 성과.(경멸)서투른 제주
accompt n. v =ACCOUNT
accord n. vi. 일치하다, 맞다, 조화하다
accordance n. 일치, 조화
accordant a.일치된;일치한;화합한;조화된
according ad.따라서, ~as(..함)에 따라서, ~to ..에 의하면, ..에 따라.그에 따라서, 그러므로
accordingly ad.따라서, 그러므로, 그에 따라서, 그에 알맞게
accordion n. 아코디언
accordion door x. 접었다 폈다하는 문
accordion pleats x. 잔주름(스커트)
accordionist n.아코디언 연주자
accost vt. n.  말을 걸다, 말붙임, 인사
accouchement n. 분만, 출산
accoucheur n. 조산원, 산부인과 의사(남자)
accoucheuse n. 산파, 조산원(여자)
account n. 계산(서), 셈, 설명, 변명, 기사, 평가, 이유, 근거, 가치, 이익
account vt. vi. ..라고 생각하다, 설명하다, 셈하다
account n. 계산서, 셈, 설명, 변명, 기사, 이유, 평가, 가치, 이익
accountability n. 책임
accountable a. 설명할 수 있는, 책임 있는
accountably ad.해명할 수 있도록
accountancy n. 회계사의 직(사무)
accountant n. 회계원, 회계사, 계리사
accountant general x. 회계(경리)과장, 경리국장(부장)
account book x. 회계장부
account current x. 교호계산
account day x. 결산일
account executive x. (광고, 서비스회사의)섭외부장
accounting n. 회계(학)
account rendered x. 대차정산서, 지불청구서
account sales x. (위탁 판매의)매상계산서, 외상판매
accouplement n. 연결, 결합, 연결재, 두 원주를 접근(밀착)시키는 공법
accouter vt. 차려 입다(sith, in), ~ment 복장, (pl)(군복, 무기 이외의)장구
accouterment n.옷차림;차려 입음;장신구;장비
accouterments a. 복장, 몸차림, 장구(무기, 군복 이외의)
Accra n. 가나의 수도
accoutre vt.차려 입다;군장하다
accredit vt. vi. 믿다, 신뢰(신임)하다, 신임장을 주어 파견하다, (어떤 행위를 남에게)돌리다, (아무의)짓으로 돌리다(~hiwith)
accreditation n. (학교, 병원 등의)인정, 인가, 신임장
accredited a. (사람, 학교 등이) 기준 합격의, 인정된, 공인된, (신앙이) 정통의, (학설 등이) 일반적으로 인정된, 용인
accrete vi. vt. 부착하다, ~에 부착시키다
accretion n. a. 부가물, (부가에 의한) 증대(-tive 부착에 의한)
accretive a. 증가(첨가)하는, 증가성의, 확대하는, 퇴적하는
accrual n. 발생, 수익을 얻음, 이자가 붙음
accrue vi. 생기다, 발생하다
acculturate vt. vi. 문화 이입에 의하여 변용 시키다(하다), 문화를 이입하다
acculturation n. 
accumulate vt. vi. 모으다, 쌓이다, 모이다(~dfund 적립금)
accumulation n. 집적, 축적
accumulative a. 쌓인, 모인, 축적하는
accumulator n. 모으는 물건(사람), 축재가, 축전지, (컴퓨터)누산기
